Google Scholar Cluster,Year,Date,eDate,Authors,Title,Type,Journal/conference/book,ISSN/ISBN,Keywords,Step,Review Group,Citation Count,Internal Citations,Debut,Same study,Conceptual framework,Methodological framework,Data source,Interval,Software,Graph construction,Structure of interest10935304083398930833,2011,Aug 25,2011/08/25,"Roque, F. S.|Jensen, P. B.|Schmock, H.|Dalgaard, M.|Andreatta, M.|Hansen, T.|Soeby, K.|Bredkjaer, S.|Juul, A.|Werge, T.|Jensen, L. J.|Brunak, S.",Using electronic patient records to discover disease correlations and stratify patient cohorts,Journal Article,PLoS Computational Biology,1553-734x,,Seed,Clinical co-occurrence,116,7392902419163354003|304338748587054938|11744806829323175461|2183433638187223115|645850665961501145|9594940078641679063|9977679068032873450|405484615237516781|18317753853438832501,2011-08-25,,Comorbidity,Natural language processing,Sct. Hans Hospital,1998Ð2008,Ð,Similarity of diseases across patient records; similarity of patient records across diseases,Communities2560662481989550073,2011,Dec 16,2011/12/16,"Siden, H.|Urbanoski, K.",Using network analysis to map the formal clinical reporting process in pediatric palliative care: A pilot study,Journal Article,BMC Health Services Research,1472-6963 (Electronic)|1472-6963 (Linking),,Seed,Workplace interaction,4,,2011-12-16,,Care coordination,Ð,BC Children's Hospital and Canuck Place Children's Hospice,JanÐMar 2008,"UCINET, NetDraw",Designated written communication between providers,"Graph, neighborhoods"16188532122261777953,2011,Sep-Oct,2011/09/15,"Uddin, S.|Hossain, L.",Social networks enabled coordination model for cost management of patient hospital admissions,Journal Article,Journal for Healthcare Quality,1945-1474,coordination model|cost management|degree centrality|hospitalization cost|patient centered,Reference,Workplace interaction,9,5477252860303490902|4125094932718142742|3520253853021664728|3001601440051743147|12669593047361150433,2011-09-15,,Care coordination,Ð,Hospital Contribution Fund,Jan 2005ÐFeb 2009,PostgreSQL,Associations between patients and doctors across encounters,"Neighborhoods, dyads"3520253853021664728,2012,Jun,2011/02/24,"Abbasi, A.|Uddin, S.|Hossain, L.",Socioeconomic analysis of patient-centric networks: Effects of patients and hospitals' characteristics and network structure on hospitalization costs,Journal Article,European Journal of Health Economics,,Social network analysis|Centrality measures|Tie strength|Hospitalization cost|Total hip replacement,Scopus,Workplace interaction,2,12669593047361150433|742906124760025150,2011-02-24,,Organizational effectiveness,Ð,Hospital Contribution Fund,Jan 2005ÐFeb 2009,Ð,Associations between patients and doctors across encounters,"Neighborhoods,  dyads"9946192549239923136,2012,Feb,2012/01/18,"Barnett, M. L.|Christakis, N. A.|O'Malley, A. J.|Onnela, J.-P.|Keating, N. L.|Landon, B. E.",Physician patient-sharing networks and the cost and intensity of care in us hospitals,Journal Article,Medical Care,0025-7079,health care costs|network analysis|primary care|health care systems|hospitals|health care variation,Seed,Physician collaboration,36,4537066903811917183|12641048451323848196|15479119673249488530|15729444450210853376|11351703201172433691|14151262832984177483|4125094932718142742|793633649644841267|13508888899711955148|8552262842231584077|3001601440051743147|15141833724125448122|17653819535321164289|12112474574544883449|12055918768487749039|2124097880840271620,2012-01-18,,Care coordination,Regression,Medicare Carrier File,2006,R > igraph,Co-occurrence of physicians across patients,"Neighborhoods, paths"14270428956862812592,2012,May,2011/09/16,"Barnett, M. L.|Keating, N. L.|Christakis, N. A.|O'Malley, A. J.|Landon, B. E.",Reasons for choice of referral physician among primary care and specialist physicians,Journal Article,Journal of General Internal Medicine,1525-1497,health services research|physician referral|reasons for referral|primary care,Reference,Physician collaboration,20,4537066903811917183,2011-09-16,,Ð,Mixed methods,Medicare,2006,"R > gee, R > Zelig",Co-occurrence of physicians across patients,Dyads1953740496731087844,2012,May,2012/05/01,"Chen, Yo.|Nyemba, S.|Malin, B.",Detecting anomalous insiders in collaborative information systems,Journal Article,IEEE Transactions on Dependable and Secure Computing,1545-5971 (Print)|1545-5971,Privacy|social network analysis|data mining|insider threat detection,PubMed,Workplace interaction,25,1477209901690465573|7084361583529973999,2012-05-01,,Inappropriate access,Anomaly detection,Vanderbilt University Medical Center,3 months in 2010,Ð,"Associations between users, patient records, and diagnosis codes across access transactions",Communities782411653304378480,2012,Feb 27,2013/02/13,"Chen, Yo.|Nyemba, S.|Zhang, W.|Malin, B.",Specializing network analysis to detect anomalous insider actions,Journal Article,Security Informatics,2190-8532 (Print),Insider threat|anomaly detection|collaborative information system|specialized network|electronic health record|access logs,PubMed,Workplace interaction,10,6828545711075462513|7084361583529973999,2012-02-27,,Inappropriate access,Anomaly detection,Vanderbilt University Medical Center,30 weeks in 2006,Ð,Similarity of users across accesses,Communities9782718888324797307,2012,Apr 25,2012/05/05,"Donker, T.|Wallinga, J.|Slack, R.|Grundmann, H.",Hospital networks and the dispersal of hospital-acquired pathogens by patient transfer,Journal Article,PLoS One,1932-6203,,PubMed,Institutional exchange,23,17562390653818184065|14453081923007059267|2755478082970559510|17959342134111868712|7408107029410258511,2012-04-25,,Epidemiology,Agent-based modeling,England National Health Service > Hospital Episode Statistics,Apr 2006ÐMar 2007,Ð,Sequential occurrence of hospitals across patients,"Communities, neighborhoods"5741716401679290878,2012,Apr 24,2012/03/19,"Ke, W.|Huang, S. S.|Hudson, L. O.|Elkins, K. R.|Nguyen, C. C.|Spratt, B. G.|Murphy, C. R.|Avery, T. R.|Lipsitch, M.",Patient sharing and population genetic structure of methicillin-resistant staphylococcus aureus,Journal Article,Proceedings of the National Academy of Sciences,,,Citation,Institutional exchange,12,17562390653818184065|14453081923007059267|17959342134111868712,2012-03-19,,Epidemiology,Regression,California Office of Statewide Health Planning and Development,2005Ð2006,Ð,Sequential occurrence of hospitals across patients,"Dyads, communities"4537066903811917183,2012,Jul 18,,"Landon, B. E.|Keating, N. L.|Barnett, M. L.|Onnela, J.-P.|Paul, S.|O'Malley, A. J.|Keegan, T.|Christakis, N. A.",Variation in patient-sharing networks of physicians across the united states,Journal Article,Journal of the American Medical Association,0098-7484,,Seed,Physician collaboration,52,12641048451323848196|11838286190902064906|15479119673249488530|15729444450210853376|11351703201172433691|14151262832984177483|4125094932718142742|13508888899711955148|8552262842231584077|3001601440051743147|10704495480470258068|11699186662207755316|12669593047361150433|15141833724125448122|17653819535321164289|12112474574544883449|12055918768487749039|2124097880840271620,2012-07-18,,Ð,Regression,Centers for Medicare & Medicaid Services,2006,Ð,Co-occurrence of physicians across patients,"Neighborhoods, paths, triads"13631684328836103551,2012,Oct,,"Lee, B. Y.|Bartsch, S. M.|Wong, K. F.|Yilmaz, S. L.|Avery, T. R.|Singh, A.|Song, Y.|Kim, D. S.|Brown, S. T.|Potter, M. A.|Platt, R.|Huang, S. S.",Simulation shows hospitals that cooperate on infection control obtain better results than hospitals acting alone,Journal Article,Health Affairs,,,Reference,Institutional exchange,19,5433537624725733394|11659103491509650714,2012-10-31,,Epidemiology,Agent-based modeling,California Office of Statewide Health Planning and Development,2006,Ð,Designated patient transfer between hospitals | Sequential occurrence of hospitals across patients,Diffusion15274025032195515406,2012,Jan,,"Lomi, A.|Pallotti, F.",Relational collaboration among spatial multipoint competitors,Journal Article,Social Networks,0378-8733,Multipoint competition|Mutual forbearance|Hospitals|Interorganizational networks|Exponential random graph models,Reference,Institutional exchange,33,10152905706519051793|4731741271071474583|7007704270923744745|11838286190902064906|13508888899711955148|2862041699259010282|11204179047977547964|12885358153772323640|9436363093917650391|3853481226495975509|3693774038279178940,2012-01-31,,Collaboration and competition,ERGM,"Lazio, Italy > Regional Hospital Information System",2003,Ð,Ð,Dyads7007704270923744745,2012,May,,"Mascia, D.|Di Vincenzo, F.|Cicchetti, A.",Dynamic analysis of interhospital collaboration and competition: Empirical evidence from an italian regional health system,Journal Article,Health Policy,0168-8510,Competition|Collaboration|Hospitals|Social network analysis|Organizational theory|Italy,Citation,Institutional exchange,11,2862041699259010282|11204179047977547964|742906124760025150|3853481226495975509|3693774038279178940,2012-05-31,,Collaboration and competition,Regression,Abruzzo Regional Health Agency,2003Ð2007,UCINET,Ð,Dyads319607914197906293,2012,Oct 22,2012/10/22,"Park, S.|Yang, J.-S.|Kim, J.|Shin, Y.-E.|Hwang, J.|Park, J.|Jang, S. K.|Kim, S.",Evolutionary history of human disease genes reveals phenotypic connections and comorbidity among genetic diseases,Journal Article,Scientific Reports,,,Citation,Clinical co-occurrence,16,13413072286841187229|9975778981456457950,2012-10-22,,Molecular biology of disease,Ð,Medicare,1990Ð1993,Ð,Co-occurrence of diseases across patients,Dyads1482646279646045885,2012,Feb,2011/10/11,"Pollack, C. E.|Weissman, G. E.|Bekelman, J. E.|Liao, K.|Armstrong, K.",Physician social networks and variation in prostate cancer treatment in three cities,Journal Article,Health Services Research,0017-9124,Physician networks|physician referral|network analysis|prostate cancer,Seed,Physician collaboration,19,4537066903811917183|12641048451323848196|15479119673249488530|15729444450210853376|14151262832984177483|8552262842231584077|2124097880840271620,2011-10-11,,Social capital and social influence,Regression,SEER-Medicare,2004Ð2006,R > igraph,Co-occurrence of physicians across patients,Communities15521562616602075778,2012,Apr,2011/01/20,"Rebuge, A.|Ferreira, D. R.",Business process analysis in healthcare environments: A methodology based on process mining,Journal Article,Information Systems,0306-4379,Business process analysis|Healthcare processes|Process mining|Sequence clustering,Citation,Workplace interaction,117,10759168924172155743|10839783135985262013,2011-01-20,,Organizational effectiveness,Process mining,Hospital of Sao Sebastiao,Jan 2009ÐJul 2009,C#,Similarity of sequence clusters,Spanning trees9194558233882348338,2012,Oct,2011/10/27,"Uddin, S.|Hossain, L.|Kelaher, M.",Effect of physician collaboration network on hospitalization cost and readmission rate,Journal Article,European Journal of Public Health,,,Reference,Physician collaboration,12,9078789530982105621|5477252860303490902|4125094932718142742|10839150707153588809|3001601440051743147|10704495480470258068|12669593047361150433,2011-10-27,,Collaborative practice,Ð,Hospital Contribution Fund,Jan 2005ÐFeb 2009,UCINET,Co-occurrence of physicians across patients,"Neighborhoods, paths, graph"4731741271071474583,2012,Nov,2012/07/27,"Veinot, T. C.|Bosk, E. A.|Unnikrishnan, K. P.|Iwashyna, T. J.","Revenue, relationships and routines: The social organization of acute myocardial infarction patient transfers in the united states",Journal Article,Social Science & Medicine,0277-9536,Interhospital patient transfers|Quality information|AMI|United States,Citation,Institutional exchange,12,11838286190902064906|11204179047977547964|12885358153772323640|9436363093917650391|3853481226495975509,2012-07-27,,Organizational effectiveness,Mixed methods,Medicare Provider Analysis and Review,1996Ð2006,Ð,Sequential occurrence of hospitals across patients,Neighborhoods254521855620065806,2012,Feb 7,2012/02/07,"Walker, A. S.|Eyre, D. W.|Wyllie, D. H.|Dingle, K. E.|Harding, R. M.|O'Connor, L.|Griffiths, D.|Vaughan, A.|Finney, J. M.|Wilcox, M. H.|Crook, D. W.|Peto, T. E. A.",Characterisation of clostridium difficile hospital ward-based transmission using extensive epidemiological data and molecular typing,Journal Article,PLoS Medicine,,,Reference,Institutional exchange,98,2755478082970559510|16276297231141117463,2012-02-07,,Epidemiology,Ð,Oxford Radcliffe Hospitals microbiology laboratory,Sep 2007-Mar 2010,"NetworkX, Python > Graphviz, MySQL",Proximate co-occurrence of patients across wards,Neighborhoods5376773155503413590,2013,Sep 26,,"Blair, D. R.|Lyttle, C. S.|Mortensen, J. M.|Bearden, C. F.|Jensen, A. B.|Khiabanian, H.|Melamed, R.|Rabadan, R.|Bernstam, E. V.|Brunak, S.|Jensen, L. J.|Nicolae, D.|Shah, N. H.|Grossman, R. L.|Cox, N. J.|White, K. P.|Rzhetsky, A.",A nondegenerate code of deleterious variants in mendelian loci contributes to complex disease risk,Journal Article,Cell,0092-8674,,Reference,Clinical co-occurrence,60,18019012530933088348|304338748587054938|11744806829323175461|15397681090571566352|405484615237516781,2013-09-26,,Molecular biology of disease,Probabilistic modeling,MarketScan,Ð,Ð,Co-occurrence of diseases across patients,"Dyads, communities"17525824778436963126,2013,Dec 30,2014/01/05,"Curtis, D. E.|Hlady, C. S.|Kanade, G.|Pemmaraju, S. V.|Polgreen, P. M.|Segre, A. M.",Healthcare worker contact networks and the prevention of hospital-acquired infections,Journal Article,PLoS One,1932-6203,,PubMed,Workplace interaction,6,,2013-12-30,,Epidemiology,Agent-based modeling,University of Iowa Hospitals and Clinics,21 months,Ð,Proximate co-occurrence of healthcare workers across login sessions,"Neighborhoods, paths, communities, triads"7278547811754330346,2013,May 1,2013/03/08,"Cusumano-Towner, M.|Li, D. Y.|Tuo, S.|Krishnan, G.|Maslove, D. M.",A social network of hospital acquired infection built from electronic medical record data,Journal Article,Journal of the American Medical Informatics Association,1067-5027,,PubMed,Workplace interaction,4,,2013-03-08,,Epidemiology,Stochastic modeling,Stanford University Medical Center,70 days,"SQL, Python",Sequential occurrence of patients across healthcare workers; co-occurrence of patients across rooms,Diffusion10107310476031659138,2013,Mar-Apr,2012/09/29,"Hanauer, D. A.|Ramakrishnan, N.",Modeling temporal relationships in large scale clinical associations,Journal Article,Journal of the American Medical Informatics Association,1067-5027,,PubMed,Clinical co-occurrence,16,14421633296636055657,2012-09-29,,Ð,Hypothesis generation,University of Michigan Health System,Ð,"R, Cytoscape",Sequential occurrence of diseases across patients,Dyads12641048451323848196,2013,Aug,2014/08/01,"Landon, B. E.|Onnela, J.-P.|Keating, N. L.|Barnett, M. L.|Paul, S.|O'Malley, A. J.|Keegan, T.|Christakis, N. A.",Using administrative data to identify naturally occurring networks of physicians,Journal Article,Medical Care,0025-7079 (Print)|1537-1948 (Electronic),Medicare|Accountable Care Organizations|social networks,Seed,Physician collaboration,20,15479119673249488530|15729444450210853376|14151262832984177483|13508888899711955148|12669593047361150433|15141833724125448122|12112474574544883449|11328982779482658636|12055918768487749039|2124097880840271620|4503635296488022601,2013-08-31,,Collaborative practice,Ð,Medicare Carrier,2006,"Python, NetworkX, R > igraph",Co-occurrence of physicians across patients,"Neighborhoods, communities"14421633296636055657,2013,Dec,2013/08/21,"Lyalina, S.|Percha, B.|LePendu, P.|Iyer, S. V.|Altman, R. B.|Shah, N. H.",Identifying phenotypic signatures of neuropsychiatric disorders from electronic medical records,Journal Article,Journal of the American Medical Informatics Association,1067-5027,,PubMed,Clinical co-occurrence,15,,2013-08-21,,Clinical ontology,Complexity reduction,"STRIDE, Palo Alto Medical Foundation",Ð,"G*Power, Cytoscape",Co-occurrence of clinical concepts across patients,"Neighborhoods, triads, graph, communities"4026134441475336276,2013,Jul-Sep,,"Mascia, D.|Di Vincenzo, F.",Dynamics of hospital competition: Social network analysis in the italian national health service,Journal Article,Health Care Management Review,0361-6274,hospital organizations|interorganizational relations|niche overlap|SIENA|strategy,Reference,Institutional exchange,4,2862041699259010282|3693774038279178940,2013-09-30,,Collaboration and competition,Agent-based modeling,Abruzzo Regional Health Agency,2003Ð2007,SIENA,Ð,"Dyads, triads, neighborhoods"10231166777839338631,2013,Dec,2013/11/07,"Nikfarjam, A.|Emadzadeh, E.|Gonzalez, G.",Towards generating a patient's timeline: Extracting temporal relationships from clinical notes,Journal Article,Journal of Biomedical Informatics,1532-0464,Temporal relation extraction|Clinical text mining|Automatic patient timeline|Natural Language Processing|Machine learning|Temporal graph,PubMed,Workplace interaction,7,,2013-11-07,,Decision support,Natural language processing,"Partners Healthcare, Beth Israel Deaconess Medical Center",Ð,Ð,Inferred temporality between events or timexes across clinical narratives,Dyads2532550215998274877,2013,Apr,2011/10/14,"Pallotti, F.|Lomi, A.|Mascia, D.",From network ties to network structures: Exponential random graph models of interorganizational relations,Journal Article,Quality & Quantity,1573-7845,Interorganizational networks|Interorganizational relations|Exponential|Random Graph Models|Hospital organizations,Citation,Institutional exchange,9,5477252860303490902,2011-10-14,,Collaboration and competition,ERGM,"Lazio, Italy > Regional Hospital Information System",2004,Ð,Ð,"Neighborhoods, triads"2433030717678364542,2013,Mar,2012/06/15,"Pollack, C. E.|Weissman, G. E.|Lemke, K. W.|Hussey, P. S.|Weiner, J. P.",Patient sharing among physicians and costs of care: A network analytic approach to care coordination using claims data,Journal Article,Journal of General Internal Medicine,0884-8734,care coordination|performance measure|provider social networks|care density,PubMed,Workplace interaction,15,15479119673249488530|793633649644841267|8552262842231584077|10704495480470258068|11699186662207755316|17653819535321164289|2124097880840271620,2012-06-15,,Care coordination,Regression,IMS Health Plan Claims Database,2009,R > igraph,Co-occurrence of providers across patients,Neighborhoods5477252860303490902,2013,Sep 10,2013/03/08,"Uddin, S.|Hamra, J.|Hossain, L.",Mapping and modeling of physician collaboration network,Journal Article,Statistics in Medicine,0277-6715,physician collaboration network|exponential random graph|hospitalization cost|readmission rate,PubMed,Physician collaboration,6,4125094932718142742|3001601440051743147|12669593047361150433|11328982779482658636|13862997009944514441,2013-03-08,,Collaborative practice,ERGM,Hospital Contribution Fund,Jan 2005ÐFeb 2009,"Organization Risk Analyzer, Pnet",Co-occurrence of physicians across patients,"Dyads, neighborhoods, triads"9078789530982105621,2013,Jun 26,2013/06/26,"Uddin, S.|Hossain, L.|Hamra, J.|Alam, A.",A study of physician collaborations through social network and exponential random graph,Journal Article,BMC Health Services Research,1472-6963,Physician collaboration network|Exponential random graph|Social network analysis|Hospitalisation cost and readmission rate,Reference,Physician collaboration,11,11351703201172433691|4125094932718142742|3001601440051743147|12669593047361150433|11328982779482658636,2013-06-26,5477252860303490902,Collaborative practice,ERGM,Hospital Contribution Fund,Jan 2005ÐFeb 2009,"Organization Risk Analyzer, Pnet",Co-occurrence of physicians across patients,"Dyads, neighborhoods, triads"6828545711075462513,2013,Dec 1,,"Zhang, He.|Mehotra, S.|Liebovitz, D.|Gunter, C. A.|Malin, B.",Mining deviations from patient care pathways via electronic medical record system audits,Journal Article,ACM Transactions on Management Information Systems,2158-656X,Anomaly detection|audit|data mining|graph-based analysis|electronic medical record systems|temporal systems,Citation,Workplace interaction,7,1477209901690465573,2013-12-01,,Inappropriate access,Anomaly detection,Northwestern Memorial Hospital,3 months in 2010,R,Sequential occurrence of users across patient record access logs,Paths11659103491509650714,2014,Sep 1,2014/05/21,"Bartsch, S. M.|Huang, S. S.|Wong, K. F.|Avery, T. R.|Lee, B. Y.",The spread and control of norovirus outbreaks among hospitals in a region: A simulation model,Journal Article,Open Forum Infectious Diseases,,hospitals|intervention|norovirus|outbreak,Citation,Institutional exchange,0,,2014-05-21,,Epidemiology,Agent-based modeling,California Office of Statewide Health Planning and Development,2006,Ð,Designated patient transfer between hospitals | Sequential occurrence of hospitals across patients,Diffusion7084361583529973999,2014,Jul,2014/05/23,"Chen, Yo.|Lorenzi, N.|Nyemba, S.|Schildcrout, J. S.|Malin, B.",We work with them? Healthcare workers interpretation of organizational relations mined from electronic health records,Journal Article,International Journal of Medical Informatics,1386-5056,Electronic health records|Organizational modeling|Data mining|Survey,Seed,Workplace interaction,3,1477209901690465573|5884760505723322221,2014-05-23,,Care coordination,Mixed methods,Vanderbilt University Medical Center,several months in 2010,R > lme4,Co-occurrence of healthcare organization areas across patient records,Dyads304338748587054938,2014,Oct 13,,"Chen, Ya.|Xu, R.",Mining cancer-specific disease comorbidities from a large observational health database,Journal Article,Cancer Informatics,,data mining|cancer informatics|systems biology|network analysis|cancer comorbidity|colorectal cancer,Citation,Clinical co-occurrence,4,405484615237516781,2014-10-13,,Molecular biology of disease,Rule mining,FDA Adverse Event Reporting System,Ð,Java > Weka,Co-occurrence of diseases across associtaion patterns,"Dyads, paths"5116663888640807073,2014,Nov,2014/11/14,"Chmiel, A.|Klimek, P.|Thurner, S.",Spreading of diseases through comorbidity networks across life and gender,Journal Article,New Journal of Physics,1367-2630,network medicine|disease dynamics|multilayer statistics|medical claims data,Scopus,Clinical co-occurrence,9,6198767401959411329|4503635296488022601,2014-11-14,,Disease progression,Ð,Main Association of Austrian Social Security Institutions,2006Ð2007,Ð,Co-occurrence of diseases across patients,"Dyads, neighborhods, triads, communities"14453081923007059267,2014,Feb 11,2014/01/27,"Ciccolini, M.|Donker, T.|Grundmann, H.|Bonten, M. J. M.|Woolhouse, M. E. J.",Efficient surveillance for healthcare-associated infections spreading between hospitals,Journal Article,Proceedings of the National Academy of Sciences,,patient referrals|network,Citation,Institutional exchange,6,2894765692799592605|7408107029410258511,2014-01-27,,Epidemiology,Stochastic modeling,UK National Health Service Hospital Episode Statistics | Dutch National Medical Register,Apr 2006ÐMar 2007 | Jan 2004ÐDec 2004,Ð,Sequential occurrence of hospitals across patients| Designated patient transfer between hospitals,"Neighborhoods, paths, graph, diffusion"17562390653818184065,2014,Jan,2013/10/01,"Donker, T.|Wallinga, J.|Grundmann, H.",Dispersal of antibiotic-resistant high-risk clones by hospital networks: Changing the patient direction can make all the difference,Journal Article,Journal of Hospital Infection,0195-6701,Antibiotic resistance|Referral patterns|Network,PubMed,Institutional exchange,12,2755478082970559510|17959342134111868712|7408107029410258511,2013-10-01,,Epidemiology,Agent-based modeling,UK National Health Service Hospital Episode Statistics,Apr 2006-Mar 2007,Ð,Ð,"Communities, diffusion"18019012530933088348,2014,Sep 16,,"Finlayson, S. G.|LePendu, P.|Shah, N. H.",Building the graph of medicine from millions of clinical narratives,Journal Article,Scientific Data,2052-4463 (online),clinical history design|data integration|Patient Observation|Medical Examination|Homo sapiens|multi-cellular organism,Citation,Clinical co-occurrence,7,,2014-09-16,,Ð,Text mining,Stanford University and i2b2,19 years,Python,Co-occurrence of diseases across patients,Dyads14165987644604991374,2014,Apr,2012/12/12,"Heer, J.|Perer, A.","Orion: A system for modeling, transformation and visualization of multidimensional heterogeneous networks",Journal Article,Information Visualization,,Social network analysis|data management|data transformation|graphs|visualization|end-user programming,Scopus,Clinical co-occurrence,27,,2012-12-12,,Decision support,Software development,an EMR,Ð,"Orion, D3",Co-occurrence of symptoms and diagnoses across patients,Graph11987064734542149183,2014,Jun 24,2014/06/24,"Jensen, A. B.|Moseley, P. L.|Oprea, T. I.|Ellesoe, S. G.|Eriksson, R.|Schmock, H.|Jensen, P. B.|Jensen, L. J.|Brunak, S.",Temporal disease trajectories condensed from population-wide registry data covering 6.2 million patients,Journal Article,Nature Communications,,,Reference,Clinical co-occurrence,20,18340469069556949129|6198767401959411329|15369475864192034659|645850665961501145,2014-06-24,,Disease progression,Ð,Danish National Patient Registsry,Jan 1996ÐNov 2010,Ð,Sequential occurrence of diseases across patients,"Paths, graphs"