Google Scholar Cluster,Year,Date,eDate,Authors,Title,Type,Journal/conference/book,ISSN/ISBN,Keywords,Step,Review Group,Citation Count,Internal Citations,Debut,Same study,Conceptual framework,Methodological framework,Data source,Interval,Software,Graph construction,Structure of interest9977679068032873450,2016,Jun,2016/05/18,"Kim, J. H.|Son, K. Y.|Shin, D. W.|Kim, S. H.|Yun, J. W.|Shin, J. H.|Kang, M. S.|Chung, E. H.|Yoo, K. H.|Yun, J. M.",Network analysis of human diseases using korean nationwide claims data,Journal Article,Journal of Biomedical Informatics,1532-0464,Claims data|Network analysis|DiseaseÛÒdisease association|Human disease network|Data-driven analysis,PubMed,Clinical co-occurrence,0,,2016-05-18,,Comorbidity,Ð,Health Insurance Review and Assessment Service > National Patient Sample,2011,"Cytoscape, R",Co-occurrence of diseases across patients,Dyads3693774038279178940,2016,Jun 4,2016/06/04,"Lee, K.-H.|Lim, S.|Park, J.","Expelled uninsured patients in a less-competitive hospital market in florida, USA",Journal Article,International Journal for Equity in Health,1475-9276,Uninsured|Patient transfers|Hospital competition,Citation,Institutional exchange,0,,2016-06-04,,Collaboration and competition,Regression,Florida Agency for Health Care Administration > Hospital Inpatient Discharge Data,2010,Ð,Sequential occurrence of hospitals across patients,Dyads645850665961501145,2016,Jan 26,2016/03/05,"Liu, J.|Ma, J.|Wang, J.|Zeng, D. D.|Song, H.|Wang, L.|Cao, Z.",Comorbidity analysis according to sex and age in hypertension patients in china,Journal Article,International Journal of Medical Sciences,1449-1907,Comorbidity|Detection Rate|Electronic Medical Records|Hypertension|Network Analysis.,PubMed,Clinical co-occurrence,0,,2016-01-26,,Comorbidity,Ð,Chinese National Surveillance System,2011Ð2013,Python,Co-occurrence of diseases across patients,Dyads17653819535321164289,2016,Apr,2015/10/17,"Lubloy, A.|Kereszturi, J. L.|Benedek, G.",Formal professional relationships between general practitioners and specialists in shared care: Possible associations with patient health and pharmacy costs,Journal Article,Applied Health Economics and Health Policy,1179-1896,,Citation,Physician collaboration,0,,2015-10-17,,Collaborative practice,Ð,DoktorInfo,2010Ð2011,Ð,Associations between GPs and SPs across patients,Dyads16268501381368212203,2016,Sep,2016/06/27,"Moen, E. L.|Austin, A. M.|Bynum, J. P.|Skinner, J. S.|O'Malley, A. J.",An analysis of patient-sharing physician networks and implantable cardioverter defibrillator therapy,Journal Article,Health Services and Outcomes Research Methodology,1387-3741 (Print)|1572-9400 (Online),Social network analysis|Centrality|Degree distribution|Structural equivalence|Exponential random graph model|Evidence-based medicine|Implantable cardioverter defibrillators,Scopus,Physician collaboration,0,,2016-06-27,,Ð,ERGM,Medicare Physician/Supplier Part B,2008,"R > statnet, R > igraph, Gephi, GeoLayout",Co-occurrence of physicians across patients; co-occurrence of hospitals across patient-sharing physicians,"Neighborhoods, paths"10704495480470258068,2016,Feb,2015/07/19,"Ong, M. S.|Olson, K. L.|Cami, A.|Liu, C.-F.|Tian, F.|Selvam, N.|Mandl, K. D.",Provider patient-sharing networks and multiple-provider prescribing of benzodiazepines,Journal Article,Journal of General Internal Medicine,0884-8734,prescribing patterns|drug overdose|social networks,PubMed,Physician collaboration,1,,2015-07-19,,Care coordination,Regression,HealthCore Integrated Research Database,2008Ð2011,Ð,Co-occurrence of physicians across patients,"Neighborhoods, dyads"9594940078641679063,2016,Jun 1,2016/04/30,"Sideris, C.|Pourhomayoun, M.|Kalantarian, H.|Sarrafzadeh, M.",A flexible data-driven comorbidity feature extraction framework,Journal Article,Computers in Biology and Medicine,0010-4825,Knowledge discovery|Comorbidity|Clustering|Prediction,PubMed,Clinical co-occurrence,0,,2016-04-30,,Comorbidity,Feature extraction,Ronald Reagan UCLA Medical Center | UCI 130-US | Healthcare Cost and Utilization Project > National Inpatient Sample,2005Ð2009 | 1999Ð2008 | 2012,Ð,Co-occurrence of diseases across patients,Communities11204179047977547964,2016,Jan,2015/06/22,"Stadtfeld, C.|Mascia, D.|Pallotti, F.|Lomi, A.",Assimilation and differentiation: A multilevel perspective on organizational and network change,Journal Article,Social Networks,0378-8733,Social networks|Organizational change|Multilevel networks|Two-mode networks|Stochastic actor-oriented model,Citation,Institutional exchange,1,,2015-06-22,,Collaboration and competition,Stochastic modeling,"Abruzzo, Italy > health system",2005Ð2011,Ð,Designated patient transfers between hospitals,"Dyads, triads"12055918768487749039,2016,Mar,2016/02/16,"Takahashi, Y.|Ishizaki, T.|Nakayama, T.|Kawachi, I.",Social network analysis of duplicative prescriptions: One-month analysis of medical facilities in japan,Journal Article,Health Policy,0168-8510,Prescription drugs|Health service research|Health policy|Social networks|Duplicative prescription,PubMed,Physician collaboration,0,,2016-02-16,,Epidemiology,Ð,Japan Medical Data Center,Dec 2012,R > sna,Co-occurrence of medical facilities across duplicative prescriptions,Graph12885358153772323640,2016,Jan,2015/08/21,"Tranmer, M.|Pallotti, F.|Lomi, A.",The embeddedness of organizational performance: Multiple membership multiple classification models for the analysis of multilevel networks,Journal Article,Social Networks,0378-8733,Health care organizations|Interorganizational fields|Interorganizational networks|Multilevel networks|Multiple Membership Multiple Classification Model|Organizational performance,Citation,Institutional exchange,1,,2015-08-21,,Collaboration and competition,Regression,"Lazio, Italy",2006,MLwiN,Ð,Graph13862997009944514441,2016,Feb 4,2016/02/04,"Uddin, S.",Exploring the impact of different multi-level measures of physician communities in patient-centric care networks on healthcare outcomes: A multi-level regression approach,Journal Article,Scientific Reports,2045-2322,,PubMed,Physician collaboration,0,,2016-02-04,,Care coordination,Regression,an Australian not-for-profit health insurance organization,5 years,Ð,Co-occurrence of physicians across patients,"Communities, graph"17959342134111868712,2016,Jul,2016/04/07,"van den Dool, C.|Haenen, A.|Leenstra, T.|Wallinga, J.",The role of nursing homes in the spread of antimicrobial resistance over the healthcare network,Journal Article,Infection Control and Hospital Epidemiology,,,Citation,Institutional exchange,0,,2016-04-07,,Epidemiology,Stochastic modeling,Sentinel Surveillance Network on Infectious Diseases in Nursing Homes | Dutch National Medical Register,2012Ð2014 | 2004,Ð,Designated patient transfers between hospitals and nursing homes,Diffusion