Google Scholar Cluster,Year,Date,eDate,Authors,Title,Type,Journal/conference/book,ISSN/ISBN,Keywords,Step,Review Group,Citation Count,Internal Citations,Debut,Same study,Conceptual framework,Methodological framework,Data source,Interval,Software,Graph construction,Structure of interest16415277536422037879,2014,,2014/04/15,"Jing, X.|Cimino, J. J.",A complementary graphical method for reducing and analyzing large data sets. Case studies demonstrating thresholds setting and selection,Journal Article,Methods of Information in Medicine,0026-1270 (Print)|0026-1270,Data mining method|data filtering method|threshold setting|threshold selection|data visualization|hierarchical terminology|data analysis|clinical data repository,PubMed,Clinical co-occurrence,0,,2014-04-15,,Clinical ontology,Complexity reduction,National Institutes of Health;  Multiparameter Intelligent Monitoring in Intensive Care II,2011,Graphviz,Associations between patients and diseases across admissions; hierarchy of terms,Graph7364335901401499652,2014,Jul 1,2014/06/03,"Liu, C.-C.|Tseng, Y.-T.|Li, W.|Wu, C.-Y.|Mayzus, I.|Rzhetsky, A.|Sun, F.|Waterman, M.|Chen, J. J. W.|Chaudhary, P. M.|Loscalzo, J.|Crandall, E.|Zhou, X. J.",Diseaseconnect: A comprehensive web server for mechanism-based disease--disease connections,Journal Article,Nucleic Acids Research,,,Citation,Clinical co-occurrence,18,5768385528986110490,2014-06-03,,Molecular biology of disease,Software development,Medicare Provider Analysis and Review,1990Ð1993,Ð,Co-occurrence of diseases across patients,Dyads11838286190902064906,2014,May,2014/04/10,"Lomi, A.|Mascia, D.|Vu, D. Q.|Pallotti, F.|Conaldi, G.|Iwashyna, T. J.",Quality of care and interhospital collaboration: A study of patient transfers in italy,Journal Article,Medical Care,0025-7079,interhospital transfer|quality of care|collaboration|network analysis|dynamic networks|readmission,PubMed,Institutional exchange,8,11204179047977547964|12885358153772323640|9436363093917650391|3853481226495975509,2014-04-10,,Collaborative practice,Survival analysis,"Abruzzo, Italy > Agency of Public Health",2005Ð2008,Ð,Sequential occurrence of hospitals across patients,"Neighborhoods, triads"15479119673249488530,2014,Nov,2014/07/26,"Mandl, K. D.|Olson, K. L.|Mines, D.|Liu, C.-F.|Tian, F.","Provider collaboration: Cohesion, constellations, and shared patients",Journal Article,Journal of General Internal Medicine,0884-8734,accountable care organizations|patient care team|physicianÛªs practice patterns,PubMed,Physician collaboration,6,10704495480470258068|4503635296488022601,2014-07-26,,Care coordination,Ð,HealthCore Integrated Research Database,2008Ð2011,Ð,Co-occurrence of physicians across patients,"Cliques, neighborhoods"7768243109589650196,2014,Apr,2013/06/28,"Menon, A. K.|Jiang, X.|Kim, J.|Vaidya, J.|Ohno-Machado, L.",Detecting inappropriate access to electronic health records using collaborative filtering,Journal Article,Machine Learning,1573-0565,Access violation|Collaborative filtering|Electronic health records|Privacy breach detection,Citation,Workplace interaction,8,6828545711075462513,2013-06-28,,Inappropriate access,Anomaly detection,"two tertiary hospitals in Boston, MA, USA",6 months in 2009,Ð,Similarity of latent user or patient clusters across explicit features,Dyads2755478082970559510,2014,Dec,2014/10/22,"Ohst, J.|Liljeros, F.|Stenhem, M.|Holme, P.",The network positions of methicillin resistant staphylococcus aureus affected units in a regional healthcare system,Journal Article,EPJ Data Science,2193-1127,network epidemiology|methicillin resistant Staphylococcus aureus|hospital system|healthcare associated infections,Citation,Institutional exchange,1,16276297231141117463,2014-10-22,,Epidemiology,Ð,Swedish public healthcare system,Ð,Ð,Sequential occurrence of units across patients,"Neighborhoods, paths, graph, diffusion"13413072286841187229,2014,Apr 14,2014/04/14,"Paik, H.|Heo, H.-S.|Ban, H.-J.|Cho, S. B.",Unraveling human protein interaction networks underlying co-occurrences of diseases and pathological conditions,Journal Article,Journal of Translational Medicine,1479-5876,Comorbidity|ProteinÛÒprotein interaction|Attack tolerance,Citation,Clinical co-occurrence,5,,2014-04-14,,Molecular biology of disease,Ð,Medicare Provider Analysis and Review,1990Ð1993,Ð,Co-occurrence of diseases across patients,Graph3907354121185999848,2014,Dec,2013/11/02,"Patel, V. N.|Kaelber, D. C.","Using aggregated, de-identified electronic health record data for multivariate pharmacosurveillance: A case study of azathioprine",Journal Article,Journal of Biomedical Informatics,1532-0464,Clinical research informatics|De-identified data|Systems biology|Postmarketing drug surveillance|Pharmacosurveillance|Azathioprine,PubMed,Clinical co-occurrence,6,,2013-11-02,,Health surveillance,Ð,Explorys,Ð,Ð,Co-occurrence of side effects across patients,Neighborhoods13508888899711955148,2014,Sep,2014/07/23,"Paul, S.|Keating, N. L.|Landon, B. E.|O'Malley, A. J.",Results from using a new dyadic-dependence model to analyze sociocentric physician networks,Journal Article,Social Science & Medicine,0277-9536,Dyadic independence|Latent variables|Patient sharing|Physician influence|Sociocentric network|Transitivity,PubMed,Physician collaboration,1,,2014-07-23,,Collaborative practice,ERGM,Centers for Medicare & Medicaid Services,2006,R,Designated referrals between physicians,"Dyads, triads"15729444450210853376,2014,Jul,,"Pollack, C. E.|Wang, H.|Bekelman, J. E.|Weissman, G. E.|Epstein, A. J.|Liao, K.|Dugoff, E. H.|Armstrong, K.",Physician social networks and variation in rates of complications after radical prostatectomy,Journal Article,Value in Health,1098-3015,cancer|claims data|health services|outcomes research,Seed,Physician collaboration,2,8552262842231584077,2014-07-31,,Collaborative practice,Regression,SEER-Medicare,2004Ð2005,R > igraph,Co-occurrence of physicians across patients,"Communities, graph"18317753853438832501,2014,Sep 9,2014/09/25,"Roitmann, E.|Eriksson, R.|Brunak, S.",Patient stratification and identification of adverse event correlations in the space of 1190 drug related adverse events,Journal Article,Frontiers in Physiology,1664-042x,adverse events|adverse drugs reactions|electronic medical records|patient stratification|data mining|network analysis,PubMed,Clinical co-occurrence,0,,2014-09-09,,Health surveillance,Text mining,a Danish mental health center,1998Ð2010,Ð,Similarity of patients across adverse events; co-occurrence of adverse events across patients,Communities17034833009335106499,2014,Dec 16,2014/12/16,"Schafer, I.|Kaduszkiewicz, H.|Wagner, H. O.|Schon, G.|Scherer, M.|van den Bussche, H.",Reducing complexity: A visualisation of multimorbidity by combining disease clusters and triads,Journal Article,BMC Public Health,1471-2458 (Electronic)|1471-2458 (Linking),Multimorbidity|Multimorbidity patterns|Disease combinations|Epidemiology|Chronic diseases|Elderly people|Factor analysis|Network analysis|Observed-expected-ratios|Claims data set,Seed,Clinical co-occurrence,11,,2014-12-16,,Comorbidity,Complexity reduction,Gmunder ErsatzKasse,2006,"R, Stata > Netplot, Visone",Co-occurrence of diseases across patients,"Triads, neighborhoods, paths"7251199940575600205,2014,Mar 5,2014/04/16,"Scott, J.|Botsis, T.|Ball, R.",Simulating adverse event spontaneous reporting systems as preferential attachment networks: Application to the vaccine adverse event reporting system,Journal Article,Applied Clinical Informatics,,Simulation|data mining|vaccines|safety|network analysis,Citation,Clinical co-occurrence,3,275418318717836749,2014-03-05,,Health surveillance,Ð,Vaccine Adverse Event Reporting System,1999,"R, Java",Co-occurrence of vaccines and adverse events across reports,Neighborhoods2499820564520733120,2014,Apr 1,2014/02/18,"Spear, S. E.",Reducing readmissions to detoxification: An interorganizational network perspective,Journal Article,Drug and Alcohol Dependence,0376-8716,Detoxification|Coordination of care|Network analysis|Multilevel modeling,PubMed,Institutional exchange,3,,2014-02-18,,Care coordination,Regression,California Outcomes Measurement System,1 Jul 2008Ð30 Jun 2009,UCINET,Sequential occurrence of treatment programs across patients,Neighborhoods1877071569727941897,2014,Dec,,"Tighe, P. J.|Davies, L.|Patel, S. S.|Lucas, S. D.|Gravenstein, N.|Bernard, H. R.",The operating room: It's a small world (and scale free network) after all,Journal Article,Connections,,,Seed,Workplace interaction,0,,2014-12-31,,Organizational effectiveness,Ð,UF Health at the University of Florida,1 day,Organization Risk Analyzer,Co-occurrence of OR staff across case assignments and reporting lines,"Paths, triads, graph, neighborhoods"10839150707153588809,2014,Jul,,"Uddin, S.|Hossain, L.",Social networks in exploring healthcare coordination,Journal Article,Asia Pacific Journal of Health Management,1833-3818,coordination performance|patient-centric care network|hospital length of stay|healthcare management|hospitalisation cost,Reference,Workplace interaction,2,11328982779482658636|13862997009944514441,2014-07-31,,Care coordination,Ð,Hospital Contribution Fund,Jan 2005ÐFeb 2009,Ð,Associations between patient and doctors across visits,Neighborhoods275418318717836749,2015,Nov,2014/08/07,"Botsis, T.|Scott, J.|Woo, E. J.|Ball, R.",Identifying similar cases in document networks using cross-reference structures,Journal Article,IEEE Journal of Biomedical and Health Informatics,2168-2194,Classification|clustering|document networks|postmarketing product surveillance|similarity,Citation,Clinical co-occurrence,0,,2014-08-07,,Clinical ontology,Ð,Vaccine Adverse Event Reporting System,Ð,Ð,Co-occurrence of preferred terms across reports,Communities15141833724125448122,2015,Dec,,"Butala, N. M.|King, M. D.|Reitsma, W.|Formica, R. N.|Abt, P. L.|Reese, P. P.|Parikh, C. R.",Association between organ procurement organization social network centrality and kidney discard and transplant outcomes,Journal Article,Transplantation,0041-1337,,Citation,Institutional exchange,0,,2015-12-31,,Organizational effectiveness,Regression,Scientific Registry of Transplant Recipients,2000Ð2010,Gephi,Designated kidney transplants between organ procurement organizations,"Graph, neighborhoods"2124097880840271620,2015,Jun,2015/04/24,"Casalino, L. P.|Pesko, M. F.|Ryan, A. M.|Nyweide, D. J.|Iwashyna, T. J.|Sun, X.|Mendelsohn, J.|Moody, J.",Physician networks and ambulatory care-sensitive admissions,Journal Article,Medical Care,0025-7079,physician networks|referrals|ambulatory care-sensitive admissions,PubMed,Physician collaboration,0,,2015-04-24,,Care coordination,Regression,Medicare Part B and Outpatient files,2008,Pajek,Co-occurrence of physicians across patients,"Communities, paths"1477209901690465573,2015,Jun,2015/04/01,"Chen, Yo.|Ghosh, J.|Bejan, C. A.|Gunter, C. A.|Gupta, S.|Kho, A.|Liebovitz, D.|Sun, J.|Denny, J. C.|Malin, B.",Building bridges across electronic health record systems through inferred phenotypic topics,Journal Article,Journal of Biomedical Informatics,1532-0464,Clinical phenotype modeling|Computers and information processing|Data mining|Electronic medical records|Medical information systems|Pattern recognition,Citation,Clinical co-occurrence,4,,2015-04-01,,Clinical ontology,Feature extraction,Vanderbilt University Medical Center | Northwestern Memorial Hospital,Ð,Ð,Similarity of phenotypic topics along clinical terms,Dyads15586454427327336256,2015,Feb,2014/10/25,"Franchini, M.|Pieroni, S.|Fortunato, L.|Molinaro, S.|Liebman, M.",Poly-pharmacy among the elderly: Analyzing the co-morbidity of hypertension and diabetes,Journal Article,Current Pharmaceutical Design,1381-6128,Diabetes|poly-pharmacy|co-morbidity|elderly|social network analysis|administrative data|hypertension,PubMed,Clinical co-occurrence,2,,2014-10-25,,Health surveillance,Ð,"Tuscany, Italy > Local Health Unit",2010,Gephi,Associations between patients and their demographic and clinical characteristics across records,"Communities, paths"15419847508180354236,2015,Sep,2015/07/18,"Hackl, F.|Hummer, M.|Pruckner, G. J.",Old boys' network in general practitioners' referral behavior?,Journal Article,Journal of Health Economics,0167-6296,Referral behavior|General practitioner|Information asymmetry|Personal networks|Affinity-based networks,PubMed,Physician collaboration,2,,2015-07-18,,Social capital and social influence,Regression,Upper Austrian Sickness Fund,1998Ð2007,Ð,Designated referrals between GPs and specialists,Dyads14151262832984177483,2015,Feb,2014/12/18,"Hollingsworth, J. M.|Funk, R. J.|Garrison, S. A.|Owen-Smith, J.|Kaufman, S. R.|Landon, B. E.|Birkmeyer, J. D.",Differences between physician social networks for cardiac surgery serving communities with high versus low proportions of black residents,Journal Article,Medical Care,0025-7079,cardiac surgery|racial disparities|social network analysis,PubMed,Physician collaboration,2,2124097880840271620,2014-12-18,,Population health,Regression,Medicare Provider Analysis and Review,2008Ð2011,Ð,Co-occurrence of physicians across patients,"Dyads, tirads, graph"793633649644841267,2015,May 1,2015/04/14,"Hussain, T.|Chang, H.-Y.|Veenstra, C. M.|Pollack, C. E.",Collaboration between surgeons and medical oncologists and outcomes for patients with stage iii colon cancer,Journal Article,Journal of Oncology Practice,,,Citation,Physician collaboration,2,,2015-04-14,,Collaborative practice,Survival analysis,SEER-Medicare,2000Ð2009,,Associations between surgeons and medical oncologists across patients,Dyads13849753041952158348,2015,Oct 16,2015/10/17,"Kwan, T. H.|Wong, N. S.|Lee, S. S.",Participation dynamics of a cohort of drug users in a low-threshold methadone treatment programme,Journal Article,Harm Reduction Journal,1477-7517,Low threshold|Methadone maintenance treatment|Injecting drug users|Social connectivity,PubMed,Institutional exchange,2,,2015-10-16,,Social capital and social influence,Ð,Hong Kong Special Administrative Region Government > Department of Health,2008,"ArcGIS, Gephi",Proximate co-occurrence of patients across methodone clinics,"Neighborhoods, paths"7075984228223359820,2015,,2015/02/05,"Li, Y.-B.|Zhou, X.-Z.|Zhang, R.-S.|Wang, Y.-H.|Peng, Y.-H.|Hu, J.-Q.|Xie, Q.|Xue, Y.-X.|Xu, L.-L.|Liu, X.-F.|Liu, B.-Y.",Detection of herb-symptom associations from traditional chinese medicine clinical data,Journal Article,Evidence-Based Complementary and Alternative Medicine,1741-427X (Print)|1741-427x,,PubMed,Clinical co-occurrence,1,,2015-02-05,,Decision support,Software development,a clinical data warehouse | Dong-fang Hospital | First Teaching Hospital of Tianjin University of TCM,2007Ð | 2005Ð2010 | Nov 2011ÐMar 2013,Ð,Co-occurrence of herb prescriptions and symptoms across patients,Neighborhoods3853481226495975509,2015,May,2015/03/22,"Mascia, D.|Angeli, F.|Di Vincenzo, F.",Effect of hospital referral networks on patient readmissions,Journal Article,Social Science & Medicine,0277-9536,Interorganizational collaboration|Patient readmission|Hierarchical linear modeling|Social network analysis,PubMed,Institutional exchange,0,,2015-03-22,,Collaboration and competition,Regression,"Abruzzo, Italy > Agency of Public Health",2005,Organization Risk Analyzer,Sequential occurrence of hospitals across patients,"Graph, neighborhoods"239186577601648228,2015,Jul*,,"Merrill, J. A.|Sheehan, B. M.|Carley, K. M.|Stetson, P. D.",Transition networks in a cohort of patients with congestive heart failure. A novel application of informatics methods to inform care coordination,Journal Article,Applied Clinical Informatics,1869-0327,Care coordination|patient care management|network analysis|heart failure|healthcare systems,Citation,Workplace interaction,0,,2015-07-31,,Care coordination,Ð,Columbia University Medical Center,Jul 2011ÐJun 2012,Organization Risk Analyzer,Associations between patients and services across visits; co-occurrence of services across patients; sequential service visits across patients,"Graph, neighborhoods, paths"18340469069556949129,2015,Jun 24,2015/06/24,"Moni, M. A.|Lio, P.",How to build personalized multi-omics comorbidity profiles,Journal Article,Frontiers in Cell and Developmental Biology,2296-634X,comorbidity|multi-omics|ontology|multiplex network|data integration,Citation,Clinical co-occurrence,1,,2015-06-24,,Comorbidity,Software development,Medicare Provider Analysis and Review,1990Ð1993,R,Co-occurrence of diseases across patients,Dyads9436363093917650391,2015,Autumn,2015/09/14,"Pallotti, F.|Tubaro, P.|Lomi, A.",How far do network effects spill over? Evidence from an empirical study of performance differentials in interorganizational networks,Journal Article,European Management Review,1740-4762,cliques|interorganizational networks|performance differentials|social influence|structural equivalence,Citation,Institutional exchange,1,,2015-09-14,,Collaboration and competition,Regression,"Laazio, Italy > regional hospital information system","2003, 2004",Ð,Ð,"Dyads, cliques, neighborhoods"8552262842231584077,2015,Aug 15,2015/04/24,"Pollack, C. E.|Soulos, P. R.|Gross, C. P.",Physician's peer exposure and the adoption of a new cancer treatment modality,Journal Article,Cancer,0008-543x,diffusion of innovation|physician patient-sharing networks|breast cancer|brachytherapy,PubMed,Physician collaboration,0,,2015-04-24,,Social capital and social influence,Regression,SEER-Medicare,2003Ð2004,,Co-occurrence of physicians across patients,Neighborhoods6762361255512973083,2015,Sep,2015/06/16,"Simmering, J. E.|Polgreen, L. A.|Campbell, D. R.|Cavanaugh, J. E.|Polgreen, P. M.",Hospital transfer network structure as a risk factor for clostridium difficile infection,Journal Article,Infection Control and Hospital Epidemiology,0899-823x,,PubMed,Institutional exchange,2,,2015-06-16,,Epidemiology,Regression,"California, USA > Healthcare Costs and Utilization Project State Inpatient Database",2005Ð2011,Ð,Sequential occurrence of hospitals across patients,"Neighborhoods, communities"5884760505723322221,2015,Mar,2015/02/20,"Soulakis, N. D.|Carson, M. B.|Lee, Y. J.|Schneider, D. H.|Skeehan, C. T.|Scholtens, D. M.",Visualizing collaborative electronic health record usage for hospitalized patients with heart failure,Journal Article,Journal of the American Medical Informatics Association,1527-974X (Electronic)|1067-5027 (Linking),Care collaboration|heart failure|electronic health records|network analysis,Seed,Workplace interaction,4,,2015-02-20,,Care coordination,Ð,Northwestern Memorial Hospital > Enterprise Data Warehouse,2012,"Gephi, R > Boost Graph Library",Co-occurrence of physicians across patients,"Communities, cliques"3001601440051743147,2015,,2015/11/09,"Uddin, S.|Kelaher, M.|Srinivasan, U.",A framework for administrative claim data to explore healthcare coordination and collaboration,Journal Article,Australian Health Review,,exponential random graph models|health insurance claim data|patient-centric care coordination network|physician collaboration network|social network measures.,Citation,Workplace interaction,1,,2015-11-09,,Care coordination,Ð,an Australian non-profite health insurance organization,Jan 2005ÐFeb 2009,Pnet,Associations between patient and doctors across visits; co-occurrence of physicians across patients,"Neighborhoods, dyads, triads"2894765692799592605,2015,Aug 28,2015/08/28,"van Bunnik, B. A. D.|Ciccolini, M.|Gibbons, C. L.|Edwards, G.|Fitzgerald, J. R.|McAdam, P. R.|Ward, M. J.|Laurenson, I. F.|Woolhouse, M. E. J.",Efficient national surveillance for health-care-associated infections,Journal Article,BMC Public Health,1471-2458,,Citation,Institutional exchange,1,,2015-08-28,,Epidemiology,Agent-based modeling,"Scotland, UK > Information Services Division",1 Jan 2007Ð31 Dec 2007,Ð,Designated patient transfers between hospitals | Sequential occurrence of hospitals across patients,Diffusion16954452513554766539,2015,Mar,2014/10/23,"Warner, J. L.|Denny, J. C.|Kreda, D. A.|Alterovitz, G.",Seeing the forest through the trees: Uncovering phenomic complexity through interactive network visualization,Journal Article,Journal of the American Medical Informatics Association,1067-5027,Medical informatics applications|Data display|Phenotype|Data mining|Decision making|computer-assisted,PubMed,Clinical co-occurrence,3,,2014-10-23,,Decision support,Software development,Multiparameter Intelligent Monitoring in Intensive Care II,Ð,R > igraph,Co-ocurrence of diseases across patients,Neighborhoods9975778981456457950,2015,Dec,2015/10/19,"Xu, H.|Moni, M. A.|Lio, P.",Network regularised cox regression and multiplex network models to predict disease comorbidities and survival of cancer,Journal Article,Computational Biology and Chemistry,1476-9271,Comorbidity|Network regularised Cox regression|Multiplex network|Survival prediction|Cancer,Citation,Clinical co-occurrence,1,,2015-10-19,,Disease progression,Survival analysis,Medicare Provider Analysis and Review,1990Ð1993,"Matlab, R",Co-occurrence of diseases across patients,Dyads13319065773913311073,2015,Sep 28,2015/10/01,"Zhang, Y.|Padman, R.|Patel, N.",Paving the cowpath: Learning and visualizing clinical pathways from electronic health record data,Journal Article,Journal of Biomedical Informatics,1532-0464,Clinical pathway|Clinical practice guideline|Visualization|Chronic kidney disease,PubMed,Workplace interaction,0,,2015-09-28,,Collaborative practice,Feature extraction,a nephrology practice in western Pennsylvania,Mar 2009ÐMay 2013,Ð,Sequential occurrence of office visits across patient records,Paths8752800357398772150,2016,Apr 26,2016/04/26,"Bagley, S. C.|Sirota, M.|Chen, R.|Butte, A. J.|Altman, R. B.",Constraints on biological mechanism from disease comorbidity using electronic medical records and database of genetic variants,Journal Article,PLoS Computational Biology,,,Seed,Clinical co-occurrence,0,,2016-04-26,,Molecular biology of disease,Hypothesis generation,Columbia University Medical Center | Stanford University Medical Center,Ð,Cytoscape,Co-occurrence of diseases across patients,Dyads15070039911616517406,2016,Jul 27,2016/07/28,"Feldman, K.|Stiglic, G.|Dasgupta, D.|Kricheff, M.|Obradovic, Z.|Chawla, N. V.",Insights into population health management through disease diagnoses networks,Journal Article,Scientific Reports,2045-2322,,PubMed,Clinical co-occurrence,0,,2016-07-27,,Population health,Ð,Healthcare Cost and Utilization Project > Nationwide Inpatient Sample,2003Ð2009,Ð,Co-occurrence of diseases across patients,"Dyads, paths, communities"12112474574544883449,2016,Apr,2016/01/14,"Geissler, K. H.|Lubin, B.|Marzilli Ericson, K. M.",Access is not enough: Characteristics of physicians who treat medicaid patients,Journal Article,Medical Care,0025-7079,health care delivery|health insurance|Medicaid|physician practice patterns|practice variation,PubMed,Physician collaboration,0,,2016-01-14,,Social capital and social influence,Regression,Massachusetts All Payer Claims Database,2011,Ð,Co-occurrence of physicians across patients,"Neighborhoods, graph"11259984925427313520,2016,May 27,2016/06/16,"Geraci, D. M.|Giuffre, M.|Bonura, C.|Graziano, G.|Saporito, L.|Insinga, V.|Rinaudo, G.|Aleo, A.|Vecchio, D.|Mammina, C.","A snapshot on mrsa epidemiology in a neonatal intensive care unit network, palermo, italy",Journal Article,Frontiers in Microbiology,1664-302x,MRSA|active surveillance|network approach|molecular typing|NICu,PubMed,Institutional exchange,0,,2016-05-27,,Epidemiology,Ð,"Palermo, Italy > Regional Health Service Statistical Office",Feb 2014ÐJan 2015,Ð,Sequential occurrence of neonatal intensive care units across patients,Neighborhoods7408107029410258511,2016,May 21,2016/05/21,"Gibbons, C. L.|van Bunnik, B. A. D.|Blatchford, O.|Robertson, C.|Porphyre, T.|Imrie, L.|Wilson, J.|Fitzgerald, J. R.|Woolhouse, M. E. J.|Chase-Topping, M. E.",Not just a matter of size: A hospital-level risk factor analysis of mrsa bacteraemia in scotland,Journal Article,BMC Infectious Diseases,1471-2334,Hospital-level|Risk|Connectivity|MRSA bacteraemia,Citation,Institutional exchange,0,,2016-05-21,,Epidemiology,Regression,Information Services Division,2007,Ð,Designated patient transfers between hospitals | Sequential occurrence of hospitals across patients,"Neighborhoods, paths"12361957703146268092,2016,Jun 15,2016/06/17,"Glicksberg, B. S.|Li, L-2.|Badgeley, M. A.|Shameer, K.|Kosoy, R.|Beckmann, N. D.|Pho, N.|Hakenberg, J.|Ma, M.|Ayers, K. L.|Hoffman, G. E.|Li, S. D.|Schadt, E. E.|Patel, C. J.|Chen, R.|Dudley, J. T.",Comparative analyses of population-scale phenomic data in electronic medical records reveal race-specific disease networks,Journal Article,Bioinformatics,1367-4803,,PubMed,Clinical co-occurrence,0,,2016-06-15,,Population health,Ð,Mount Sinai Hospital,ÐFeb 2015,Cytoscape > NetworkAnalyzer,sequential occurrence of diseases across patients; co-occurrence of diseases across patients,"Dyads, neighborhoods"6198767401959411329,2016,May 23,2016/05/23,"Kannan, V.|Swartz, F.|Kiani, N. A.|Silberberg, G.|Tsipras, G.|Gomez-Cabrero, D.|Alexanderson, K.|Tegner, J.",Conditional disease development extracted from longitudinal health care cohort data using layered network construction,Journal Article,Scientific Reports,2045-2322 (online),,Citation,Clinical co-occurrence,0,,2016-05-23,,Disease progression,Hypothesis generation,Statistics Sweden | Swedish Board of Health and Welfare | Swedish Social Insurance Agency,1997Ð2009,R > igraph,Co-occurrence of diseases across patients,"Dyads, communities"